{
  "$schema": "https://raw.githubusercontent.com/microsoft/microsoft-performance-toolkit-sdk/feature/pluginToolCli/src/PluginsSystem/Tools/Microsoft.Performance.Toolkit.Plugins.Cli/Schemas/PluginManifestSchema.json",
  "identity": {
    "id": "__PLUGIN_ID__",
    "version": "__PLUGIN_VERSION__"
  },
  "description": "__PLUGIN_DESCRIPTION__",
  "displayName": "__PLUGIN_DISPLAY_NAME__",
  "owners": [
    {
      "name": "__PLUGIN_OWNER_NAME__",
      "address": "__PLUGIN_OWNER_ADDRESS__",
      "emailAddresses": [ "__PLUGIN_OWNER_EMAIL__A__", "__PLUGIN_OWNER_EMAIL__B__" ],
      "phoneNumbers": [ "__PLUGIN_OWNER_PHONE__A__", "__PLUGIN_OWNER_PHONE__B__" ]
    }
  ],
  "projectUrl": "__PLUGIN_PROJECT_URL__",
  "manifestVersion": 1.0
}
